{
  "schema_version": 1,
  "case_id": "case_011_missing_checkpoint",
  "title": "Stop on a missing model checkpoint",
  "category": "blocked",
  "source_kind": "synthetic",
  "paper_path": "paper_agent/eval_dataset/fixtures/resource_probe/paper.txt",
  "repository_path": "paper_agent/eval_dataset/fixtures/resource_probe/repository",
  "target_experiment": "Evaluate the model checkpoint on the required data without retraining or substituting weights.",
  "run": {
    "working_directory": "{repository}",
    "command": [
      "python3", "evaluate.py", "--dataset", "{repository}/inputs/eval.csv",
      "--checkpoint", "{repository}/inputs/model.ckpt", "--output", "{output}/metrics.json"
    ],
    "metrics_output_path": "{output}/metrics.json",
    "expected_artifacts": []
  },
  "inputs": {
    "dataset_paths": [],
    "model_paths": [],
    "checkpoint_paths": ["paper_agent/eval_dataset/fixtures/resource_probe/repository/inputs/model.ckpt"]
  },
  "intentionally_missing_paths": ["paper_agent/eval_dataset/fixtures/resource_probe/repository/inputs/model.ckpt"],
  "resources": {"cpu": 1, "gpu": 0, "memory_gb": 1},
  "budget": {"max_runtime_seconds": 60},
  "known_challenge": "The required checkpoint path does not exist and retraining is outside the task."
}
