{
  "schema_version": 1,
  "case_id": "case_005_repair_entrypoint",
  "title": "Repair a stale experiment entrypoint",
  "category": "repair",
  "source_kind": "synthetic",
  "paper_path": "paper_agent/eval_dataset/fixtures/repair_entrypoint/paper.txt",
  "repository_path": "paper_agent/eval_dataset/fixtures/repair_entrypoint/repository",
  "target_experiment": "Run the deterministic regression sanity check and verify mean absolute error.",
  "run": {
    "working_directory": "{repository}",
    "command": ["python3", "train.py", "--output", "{output}/metrics.json"],
    "metrics_output_path": "{output}/metrics.json",
    "expected_artifacts": ["{output}/metrics.json"]
  },
  "inputs": {"dataset_paths": [], "model_paths": [], "checkpoint_paths": []},
  "resources": {"cpu": 1, "gpu": 0, "memory_gb": 1},
  "budget": {"max_runtime_seconds": 120},
  "known_challenge": "The documented train.py path is stale; the current entrypoint must be discovered in the repository."
}
